{
  "$schema": "./themes.schema.json",
  "version": "1.0.0",
  "defaultTheme": "default",
  "storageKey": "sellerhub-theme",
  
  "themes": {
    "default": {
      "name": "Default Green",
      "description": "Clean green theme with vibrant accent colors",
      "isDark": false,
      "colors": {
        "primary": "#16a34a",
        "primaryHover": "#15803d",
        "primaryLight": "#22c55e",
        "secondary": "#64748b",
        "accent": "#f59e0b",
        "background": "#ffffff",
        "surface": "#f8fafc",
        "textPrimary": "#1e293b",
        "textSecondary": "#64748b",
        "textMuted": "#94a3b8",
        "border": "#e2e8f0",
        "success": "#22c55e",
        "warning": "#f59e0b",
        "danger": "#ef4444",
        "info": "#3b82f6",
        "sidebarBg": "#1e293b",
        "sidebarText": "#f1f5f9",
        "cardShadow": "0 1px 3px 0 rgb(0 0 0 / 0.1), 0 1px 2px -1px rgb(0 0 0 / 0.1)"
      }
    },
    "dark": {
      "name": "Dark Mode",
      "description": "Dark theme for reduced eye strain",
      "isDark": true,
      "colors": {
        "primary": "#22c55e",
        "primaryHover": "#16a34a",
        "primaryLight": "#4ade80",
        "secondary": "#94a3b8",
        "accent": "#f59e0b",
        "background": "#0f172a",
        "surface": "#1e293b",
        "textPrimary": "#f1f5f9",
        "textSecondary": "#94a3b8",
        "textMuted": "#64748b",
        "border": "#334155",
        "success": "#22c55e",
        "warning": "#f59e0b",
        "danger": "#ef4444",
        "info": "#3b82f6",
        "sidebarBg": "#020617",
        "sidebarText": "#f1f5f9",
        "cardShadow": "0 1px 3px 0 rgb(0 0 0 / 0.3), 0 1px 2px -1px rgb(0 0 0 / 0.3)"
      }
    },
    "ocean": {
      "name": "Ocean Blue",
      "description": "Calm blue theme inspired by the ocean",
      "isDark": false,
      "colors": {
        "primary": "#0ea5e9",
        "primaryHover": "#0284c7",
        "primaryLight": "#38bdf8",
        "secondary": "#0369a1",
        "accent": "#06b6d4",
        "background": "#f0f9ff",
        "surface": "#e0f2fe",
        "textPrimary": "#0c4a6e",
        "textSecondary": "#0369a1",
        "textMuted": "#0284c7",
        "border": "#bae6fd",
        "success": "#22c55e",
        "warning": "#f59e0b",
        "danger": "#ef4444",
        "info": "#0ea5e9",
        "sidebarBg": "#0c4a6e",
        "sidebarText": "#f0f9ff",
        "cardShadow": "0 1px 3px 0 rgb(14 165 233 / 0.1), 0 1px 2px -1px rgb(14 165 233 / 0.1)"
      }
    },
    "purple": {
      "name": "Purple Violet",
      "description": "Modern purple theme with vibrant violet accent colors",
      "isDark": false,
      "colors": {
        "primary": "#8b5cf6",
        "primaryHover": "#7c3aed",
        "primaryLight": "#a78bfa",
        "secondary": "#6b21a8",
        "accent": "#c084fc",
        "background": "#faf5ff",
        "surface": "#f3e8ff",
        "textPrimary": "#4c1d95",
        "textSecondary": "#6b21a8",
        "textMuted": "#9333ea",
        "border": "#e9d5ff",
        "success": "#22c55e",
        "warning": "#f59e0b",
        "danger": "#ef4444",
        "info": "#8b5cf6",
        "sidebarBg": "#4c1d95",
        "sidebarText": "#faf5ff",
        "cardShadow": "0 1px 3px 0 rgb(139 92 246 / 0.1), 0 1px 2px -1px rgb(139 92 246 / 0.1)"
      }
    },
    "sunset": {
      "name": "Sunset Orange",
      "description": "Warm sunset theme with vibrant orange accent colors",
      "isDark": false,
      "colors": {
        "primary": "#f97316",
        "primaryHover": "#ea580c",
        "primaryLight": "#fb923c",
        "secondary": "#92400e",
        "accent": "#f59e0b",
        "background": "#fffbeb",
        "surface": "#fef3c7",
        "textPrimary": "#78350f",
        "textSecondary": "#92400e",
        "textMuted": "#b45309",
        "border": "#fde68a",
        "success": "#22c55e",
        "warning": "#f59e0b",
        "danger": "#ef4444",
        "info": "#3b82f6",
        "sidebarBg": "#78350f",
        "sidebarText": "#fffbeb",
        "cardShadow": "0 1px 3px 0 rgb(249 115 22 / 0.1), 0 1px 2px -1px rgb(249 115 22 / 0.1)"
      }
    }
  },
  
  "colorMapping": {
    "primary": "--primary-color",
    "primaryHover": "--primary-hover",
    "primaryLight": "--primary-light",
    "secondary": "--secondary-color",
    "accent": "--accent-color",
    "background": "--background-color",
    "surface": "--surface-color",
    "textPrimary": "--text-primary",
    "textSecondary": "--text-secondary",
    "textMuted": "--text-muted",
    "border": "--border-color",
    "success": "--success-color",
    "warning": "--warning-color",
    "danger": "--danger-color",
    "info": "--info-color",
    "sidebarBg": "--sidebar-bg",
    "sidebarText": "--sidebar-text",
    "cardShadow": "--card-shadow"
  }
}
